<xs:schema xmlns:xs="http://www.w3.org/2001/XMLSchema">

    <xs:element name="usuarios"></xs:element>

    <xs:element name="usuario">
        <xs:complexType>
            <xs:sequence>
                <xs:element name="nombre" type="xs:string"></xs:element>
                <xs:element name="edad" type="xs:int"></xs:element>
                <xs:element name="email" type="xs:string"></xs:element>
            </xs:sequence>
            <xs:attribute name="id" type="xs:int"></xs:attribute>
            <!-- los atributos van fuera y después del sequence-->
        </xs:complexType>
    </xs:element>
</xs:schema>